{
  "$schema": "http://json-schema.org/draft-03/schema",
  "required": true,
  "type": "object",
  "properties": {
    "checker": {
      "required": false,
      "type": "object",
      "properties": {
        "member_city": {
          "required": false,
          "type": "string"
        },
        "member_country": {
          "required": false,
          "type": "string"
        },
        "member_id": {
          "required": false,
          "type": "integer"
        },
        "member_state": {
          "required": false,
          "type": "string"
        },
        "name": {
          "required": false,
          "type": "string"
        }
      }
    },
    "checkin_id": {
      "required": false,
      "type": "integer"
    },
    "comment": {
      "required": false,
      "type": "string"
    },
    "event_id": {
      "required": false,
      "type": "integer"
    },
    "group_id": {
      "required": false,
      "type": "integer"
    },
    "lat": {
      "required": false,
      "type": "number"
    },
    "lon": {
      "required": false,
      "type": "number"
    },
    "member_id": {
      "required": false,
      "type": "integer"
    },
    "member_name": {
      "required": false,
      "type": "string"
    },
    "time": {
      "required": false,
      "type": "integer"
    }
  }
}
